{
  "esquema": "1.2",
  "id": "deuda-externa.indec",
  "serie": "deuda-externa",
  "codigo": "EXT-07",
  "nombre": "Deuda externa total",
  "variante": "indec",
  "nombre_variante": "INDEC, deuda externa bruta, trimestral (desde 2006)",
  "es_variante_por_defecto": false,
  "unidad": "millones de US$ corrientes",
  "tipo": "stock",
  "agregacion": "fin_de_periodo",
  "frecuencia": "trimestral",
  "moneda": "dolares",
  "metodo": "Deuda externa bruta total del INDEC (por sector residente), saldo a fin de trimestre, sin cambios. La copia de datos.gob.ar llega hasta el segundo trimestre de 2024.",
  "empalme": "yuxtaponer",
  "transformaciones": [
    "var_interanual",
    "base_100",
    "frecuencia",
    "media_movil",
    "pct_pib"
  ],
  "insumos": {
    "pct_pib": {
      "opciones": [
        {
          "id": "pib-dolares.anual",
          "archivo": "auxiliares/pib-dolares/anual.json",
          "nombre": "Anual",
          "frecuencia": "anual"
        },
        {
          "id": "pib-dolares.trimestral",
          "archivo": "auxiliares/pib-dolares/trimestral.json",
          "nombre": "Trimestral (desde 1993)",
          "frecuencia": "trimestral"
        }
      ],
      "por_defecto": "pib-dolares.anual",
      "unidad": "% del PIB"
    }
  },
  "auxiliar": false,
  "tramos": [
    {
      "fuente": "f.indec.deuda-externa-bruta",
      "desde": "2006-01",
      "hasta": "hoy",
      "frecuencia": "trimestral"
    }
  ],
  "cobertura": {
    "desde": "2006-01",
    "hasta": "2024-04"
  },
  "advertencias": [
    {
      "id": "q.deuda-externa.criterios",
      "desde": "1970",
      "hasta": null,
      "tipo": "metodologia",
      "descripcion": "El Banco Mundial y el INDEC registran la deuda externa con criterios distintos y sus cifras no coinciden: en 1993–2000 el Banco Mundial da entre 4 % menos y 10 % más que el INDEC, pero en 1991, 1992 y 2001 da entre 44 % y 66 % más, y entre 2006 y 2023 da entre 21 % menos y 6 % más (−13 % en 2006, −12 % en 2023). Las variantes no se unen: para comparar en el tiempo, conviene usar una sola."
    }
  ],
  "excluidos": [],
  "fuentes": [
    {
      "id": "f.indec.deuda-externa-bruta",
      "organismo": "INDEC",
      "nombre": "Deuda externa bruta por sector residente. Total, saldo a fin de trimestre",
      "url": "https://apis.datos.gob.ar/series/api/series/?ids=161.1_TL_DEUDRNA_0_0_19",
      "licencia": "CC-BY-4.0",
      "id_api": "161.1_TL_DEUDRNA_0_0_19"
    }
  ],
  "licencia": "CC-BY-4.0",
  "cita": "Vaivén (2026). Deuda externa total, variante «indec». Versión de datos 2026-10-27. https://vaiven.argentino.workers.dev/series/deuda-externa/indec/",
  "version_datos": "2026-10-27T19:55:59Z",
  "desactualizada_desde": null,
  "datos": [
    ["2006-01", 130145.3212],
    ["2006-04", 133565.5913],
    ["2006-07", 133936.592],
    ["2006-10", 137089.894],
    ["2007-01", 139734.3935],
    ["2007-04", 147362.0262],
    ["2007-07", 149670.4716],
    ["2007-10", 153400.4548],
    ["2008-01", 158391.8819],
    ["2008-04", 162093.2506],
    ["2008-07", 158342.6049],
    ["2008-10", 154090.8622],
    ["2009-01", 150056.1967],
    ["2009-04", 151290.377],
    ["2009-07", 153727.1316],
    ["2009-10", 149359.1893],
    ["2010-01", 148520.5907],
    ["2010-04", 140919.2564],
    ["2010-07", 143410.6602],
    ["2010-10", 144653.2954],
    ["2011-01", 148792.1204],
    ["2011-04", 154528.6621],
    ["2011-07", 155737.7922],
    ["2011-10", 156299.8801],
    ["2012-01", 158565.2493],
    ["2012-04", 159405.2802],
    ["2012-07", 157647.5725],
    ["2012-10", 156478.164],
    ["2013-01", 155181.834],
    ["2013-04", 153754.1717],
    ["2013-07", 155356.7436],
    ["2013-10", 155488.9232],
    ["2014-01", 156119.6787],
    ["2014-04", 161891.1278],
    ["2014-07", 156730.2252],
    ["2014-10", 158742.249],
    ["2015-01", 160671.0054],
    ["2015-04", 167581.4433],
    ["2015-07", 171551.1085],
    ["2015-10", 167411.8361],
    ["2016-01", 176643.5307],
    ["2016-04", 176971.0417],
    ["2016-07", 179954.6115],
    ["2016-10", 181432.3645],
    ["2017-01", 199161.1033],
    ["2017-04", 204914.4158],
    ["2017-07", 217509.9161],
    ["2017-10", 234548.9464],
    ["2018-01", 253168.0642],
    ["2018-04", 261678.6524],
    ["2018-07", 255050.2093],
    ["2018-10", 277827.0087],
    ["2019-01", 275662.0726],
    ["2019-04", 283129.1479],
    ["2019-07", 276814.532],
    ["2019-10", 278489.215],
    ["2020-01", 275165.3847],
    ["2020-04", 269913.1156],
    ["2020-07", 267537.0679],
    ["2020-10", 270694.3583],
    ["2021-01", 267693.5065],
    ["2021-04", 268856.5984],
    ["2021-07", 267444.9472],
    ["2021-10", 266476.3979],
    ["2022-01", 273532.5479],
    ["2022-04", 273919.2535],
    ["2022-07", 270907.7031],
    ["2022-10", 276215.9075],
    ["2023-01", 275710.5981],
    ["2023-04", 276327.4714],
    ["2023-07", 283084.6723],
    ["2023-10", 287808.6265],
    ["2024-01", 289642.6758],
    ["2024-04", 286881.053]
  ]
}
