{
  "esquema": "1.2",
  "id": "deuda-publica.externa-bm",
  "serie": "deuda-publica",
  "codigo": "FIS-04",
  "nombre": "Deuda pública",
  "variante": "externa-bm",
  "nombre_variante": "Deuda externa pública y con garantía pública, de largo plazo, Banco Mundial (1970–2024)",
  "es_variante_por_defecto": true,
  "unidad": "millones de US$ corrientes",
  "tipo": "stock",
  "agregacion": "fin_de_periodo",
  "frecuencia": "anual",
  "moneda": "dolares",
  "metodo": "Deuda externa de largo plazo del sector público y la privada con garantía pública, según la base International Debt Statistics del Banco Mundial (DT.DOD.DPPG.CD), en millones de dólares. Es la misma serie que la variante «pública» de la deuda externa (EXT-07).",
  "empalme": "yuxtaponer",
  "transformaciones": [
    "var_interanual",
    "base_100",
    "frecuencia",
    "media_movil",
    "pct_pib"
  ],
  "insumos": {
    "pct_pib": {
      "opciones": [
        {
          "id": "pib-dolares.anual",
          "archivo": "auxiliares/pib-dolares/anual.json",
          "nombre": "Anual",
          "frecuencia": "anual"
        },
        {
          "id": "pib-dolares.trimestral",
          "archivo": "auxiliares/pib-dolares/trimestral.json",
          "nombre": "Trimestral (desde 1993)",
          "frecuencia": "trimestral"
        }
      ],
      "por_defecto": "pib-dolares.anual",
      "unidad": "% del PIB"
    }
  },
  "auxiliar": false,
  "tramos": [
    {
      "fuente": "f.bm.deuda-externa-publica",
      "desde": "1970",
      "hasta": "hoy",
      "frecuencia": "anual"
    }
  ],
  "cobertura": {
    "desde": "1970",
    "hasta": "2024"
  },
  "advertencias": [
    {
      "id": "q.deuda-publica.solo-externa",
      "desde": "1970",
      "hasta": null,
      "tipo": "cobertura",
      "descripcion": "No es la deuda pública total: es solo la deuda externa de largo plazo del sector público (y la privada con garantía pública), según el Banco Mundial. No incluye la deuda pública en moneda local con residentes. La serie total de la Secretaría de Finanzas y la del FMI están pendientes de licencia."
    },
    {
      "id": "q.deuda-externa.componentes-bm",
      "desde": "1970",
      "hasta": null,
      "tipo": "metodologia",
      "descripcion": "La pública y la privada del Banco Mundial son solo de largo plazo: no suman el total, que además incluye el crédito del FMI y la deuda de corto plazo (por ejemplo, en 1990: 47.154 + 1.800 de largo plazo, 3.083 del FMI y 10.440 de corto plazo, sobre un total de 62.478 millones)."
    }
  ],
  "excluidos": [],
  "fuentes": [
    {
      "id": "f.bm.deuda-externa-publica",
      "organismo": "Banco Mundial (International Debt Statistics)",
      "nombre": "Deuda externa de largo plazo pública y con garantía pública (stock), en US$ corrientes (DT.DOD.DPPG.CD), Argentina",
      "url": "https://data.worldbank.org/indicator/DT.DOD.DPPG.CD?locations=AR",
      "licencia": "CC-BY-4.0",
      "id_api": "DT.DOD.DPPG.CD"
    }
  ],
  "licencia": "CC-BY-4.0",
  "cita": "Vaivén (2026). Deuda pública, variante «externa-bm». Versión de datos 2026-10-27. https://vaiven.argentino.workers.dev/series/deuda-publica/",
  "version_datos": "2026-10-27T19:55:59Z",
  "desactualizada_desde": null,
  "datos": [
    ["1970", 1963.191434],
    ["1971", 2256.903964],
    ["1972", 2498.891468],
    ["1973", 2938.70775],
    ["1974", 3421.164058],
    ["1975", 3302.79569],
    ["1976", 4654.292885],
    ["1977", 5266.271831],
    ["1978", 6977.657038],
    ["1979", 8827.035027],
    ["1980", 10346.06371],
    ["1981", 10722.12819],
    ["1982", 16039.00426],
    ["1983", 25628.65563],
    ["1984", 26904.1396],
    ["1985", 37538.0377],
    ["1986", 41196.29622],
    ["1987", 49483.26286],
    ["1988", 47819.53778],
    ["1989", 52113.88485],
    ["1990", 47154.00932],
    ["1991", 47843.44883],
    ["1992", 47871.49574],
    ["1993", 46139.57317],
    ["1994", 50588.76002],
    ["1995", 55221.00968],
    ["1996", 62287.15734],
    ["1997", 66984.54133],
    ["1998", 77240.80507],
    ["1999", 90264.20798],
    ["2000", 90357.82454],
    ["2001", 86641.60623],
    ["2002", 90234.09946],
    ["2003", 96673.89904],
    ["2004", 103055.4421],
    ["2005", 59419.25838],
    ["2006", 63381.2798],
    ["2007", 71086.10093],
    ["2008", 70922.47311],
    ["2009", 75795.99567],
    ["2010", 69183.29997],
    ["2011", 71537.52704],
    ["2012", 70576.87412],
    ["2013", 69885.59356],
    ["2014", 76272.14893],
    ["2015", 72820.09276],
    ["2016", 106601.6461],
    ["2017", 128245.2397],
    ["2018", 135601.9337],
    ["2019", 121318.259],
    ["2020", 118080.1492],
    ["2021", 114796.7628],
    ["2022", 110318.8223],
    ["2023", 112885.9802],
    ["2024", 110608.4857]
  ]
}
