{
  "esquema": "1.2",
  "id": "fuga.activos-externos",
  "serie": "fuga",
  "codigo": "EXT-08",
  "nombre": "Fuga de capitales",
  "variante": "activos-externos",
  "nombre_variante": "Stock de activos externos del sector privado (desde 1991)",
  "es_variante_por_defecto": false,
  "unidad": "millones de US$",
  "tipo": "flujo",
  "agregacion": "fin_de_periodo",
  "frecuencia": "anual",
  "moneda": "dolares",
  "metodo": "Stock de activos externos del sector privado: la serie del BCRA según el balance de pagos hasta 2005 y los activos de «otros sectores» de la posición de inversión internacional del INDEC desde 2006, unidos sin ajustar.",
  "empalme": "yuxtaponer",
  "transformaciones": [
    "frecuencia",
    "media_movil",
    "pct_pib"
  ],
  "insumos": {},
  "auxiliar": false,
  "tramos": [
    {
      "fuente": "f.bcra.activos-externos-bp",
      "desde": "1991",
      "hasta": "2005",
      "frecuencia": "anual"
    },
    {
      "fuente": "f.indec.pii-activos-otros-sectores",
      "desde": "2006",
      "hasta": "hoy",
      "frecuencia": "anual"
    }
  ],
  "cobertura": {
    "desde": "1991",
    "hasta": "2024"
  },
  "advertencias": [
    {
      "id": "q.fuga.mediciones",
      "desde": "1991",
      "hasta": null,
      "tipo": "metodologia",
      "descripcion": "No hay una medición oficial única de la fuga de capitales. La formación de activos externos del balance cambiario mide compras netas de divisas en el mercado de cambios; la variación del stock de activos externos incluye además los cambios de valor; el método residual (pendiente) la estima con el balance de pagos. Las variantes miden cosas distintas y no se comparan entre sí."
    },
    {
      "id": "q.fuga.otros-sectores-2006",
      "desde": "2006",
      "hasta": "2006",
      "tipo": "metodologia",
      "descripcion": "Cambio de fuente: hasta 2005, los activos externos del sector privado según el balance de pagos del BCRA; desde 2006, los activos de «otros sectores» de la posición de inversión internacional del INDEC (otras sociedades financieras, sociedades no financieras y hogares). En 2006–2009, cuando hay las dos, difieren menos de 0,3 %."
    }
  ],
  "excluidos": [
    {
      "fecha": "2025",
      "motivo": "La fuente publica 0 para 2025, un valor de relleno (el stock de 2024 es de 403.856 millones)."
    }
  ],
  "fuentes": [
    {
      "id": "f.bcra.activos-externos-bp",
      "organismo": "BCRA (publicado por la Subsecretaría de Programación Macroeconómica)",
      "nombre": "Activos externos en millones de dólares. Activos externos del sector privado según el balance de pagos",
      "url": "https://apis.datos.gob.ar/series/api/series/?ids=336.1_ACTIVOS_SEGOS__27",
      "licencia": "CC-BY-4.0",
      "id_api": "336.1_ACTIVOS_SEGOS__27"
    },
    {
      "id": "f.indec.pii-activos-otros-sectores",
      "organismo": "INDEC",
      "nombre": "Posición de inversión internacional. Activos de otros sectores, anual",
      "url": "https://apis.datos.gob.ar/series/api/series/?ids=144.3_ACVOSOTLES_0_A_30",
      "licencia": "CC-BY-4.0",
      "id_api": "144.3_ACVOSOTLES_0_A_30"
    }
  ],
  "licencia": "CC-BY-4.0",
  "cita": "Vaivén (2026). Fuga de capitales, variante «activos-externos». Versión de datos 2026-10-27. https://vaiven.argentino.workers.dev/series/fuga/activos-externos/",
  "version_datos": "2026-10-27T19:41:49Z",
  "desactualizada_desde": null,
  "datos": [
    ["1991", 50063.0],
    ["1992", 50768.0],
    ["1993", 56182.0],
    ["1994", 57859.0],
    ["1995", 69314.0],
    ["1996", 76567.0],
    ["1997", 83872.0],
    ["1998", 89549.0],
    ["1999", 97003.0],
    ["2000", 98714.0],
    ["2001", 101437.0],
    ["2002", 109166.0],
    ["2003", 118008.0],
    ["2004", 122520.0],
    ["2005", 122169.0],
    ["2006", 133985.9936],
    ["2007", 146409.0567],
    ["2008", 148732.5536],
    ["2009", 161917.5748],
    ["2010", 173525.8367],
    ["2011", 194853.8069],
    ["2012", 206678.2654],
    ["2013", 217116.218],
    ["2014", 222464.8447],
    ["2015", 232323.4125],
    ["2016", 235380.4445],
    ["2017", 266193.9671],
    ["2018", 292967.1248],
    ["2019", 334740.3233],
    ["2020", 343084.5779],
    ["2021", 361546.9342],
    ["2022", 367491.1278],
    ["2023", 397603.2544],
    ["2024", 403856.2088]
  ]
}
