{
  "esquema": "1.2",
  "id": "desocupacion.total-urbano",
  "serie": "desocupacion",
  "codigo": "TRA-01",
  "nombre": "Tasa de desocupación",
  "variante": "total-urbano",
  "nombre_variante": "Total de aglomerados urbanos, sin empalmar",
  "es_variante_por_defecto": true,
  "unidad": "% de la población económicamente activa",
  "tipo": "tasa",
  "agregacion": "promedio",
  "frecuencia": "semestral (1974–2003) y trimestral (2003–hoy)",
  "moneda": null,
  "metodo": "EPH puntual (ondas de mayo y octubre, 1974–2003) seguida de la EPH continua (trimestral, desde el tercer trimestre de 2003), sin coeficientes de empalme. La fuente publica fracciones; se multiplican por 100.",
  "empalme": "yuxtaponer",
  "transformaciones": [
    "base_100",
    "frecuencia",
    "media_movil"
  ],
  "insumos": {},
  "auxiliar": false,
  "tramos": [
    {
      "fuente": "f.indec.eph-puntual-total",
      "desde": "1974-05",
      "hasta": "2003-05",
      "frecuencia": "semestral"
    },
    {
      "fuente": "f.indec.eph-continua-total",
      "desde": "2003-07",
      "hasta": "hoy",
      "frecuencia": "trimestral"
    }
  ],
  "cobertura": {
    "desde": "1974-05",
    "hasta": "2026-04"
  },
  "advertencias": [
    {
      "id": "q.desocupacion.eph-2003",
      "desde": "2003-05",
      "hasta": "2003-07",
      "tipo": "metodologia",
      "descripcion": "Cambio de encuesta: la EPH puntual (dos ondas por año, en mayo y octubre; la fuente las fecha en mayo y noviembre) se reemplazó por la EPH continua (resultados trimestrales) desde el tercer trimestre de 2003. Las tasas no son directamente comparables y en estas variantes no se aplican coeficientes de empalme."
    },
    {
      "id": "q.desocupacion.aglomerados",
      "desde": "1974-05",
      "hasta": "2003-05",
      "tipo": "cobertura",
      "descripcion": "La cantidad de aglomerados relevados por la EPH puntual creció a lo largo del período, así que el «total de aglomerados urbanos» no tiene la misma cobertura en todos los años. La EPH continua cubre hoy 31 aglomerados."
    },
    {
      "id": "q.desocupacion.planes-2002",
      "desde": "2002-05",
      "hasta": null,
      "tipo": "metodologia",
      "descripcion": "Desde 2002, las personas que reciben planes de empleo con contraprestación laboral (como el Plan Jefes y Jefas de Hogar) se cuentan como ocupadas. Si se las contara como desocupadas, la tasa sería más alta."
    },
    {
      "id": "q.desocupacion.emergencia-2016",
      "desde": "2015-10",
      "hasta": "2016-01",
      "tipo": "intervencion",
      "descripcion": "Emergencia estadística: el INDEC no publicó la EPH del cuarto trimestre de 2015 ni la del primero de 2016."
    }
  ],
  "excluidos": [],
  "fuentes": [
    {
      "id": "f.indec.eph-puntual-total",
      "organismo": "INDEC (publicado por la Subsecretaría de Programación Macroeconómica)",
      "nombre": "EPH puntual. Tasa de desocupación, total de aglomerados urbanos, 1974–2003",
      "url": "https://datos.gob.ar/dataset/sspm-tasa-desocupacion-por-aglomerado-1974-2003",
      "licencia": "CC-BY-4.0",
      "id_api": "343.1_TOTAL_AGLONOS__25"
    },
    {
      "id": "f.indec.eph-continua-total",
      "organismo": "INDEC (publicado por la Subsecretaría de Programación Macroeconómica)",
      "nombre": "EPH continua. Tasa de desocupación, total de aglomerados urbanos, trimestral",
      "url": "https://apis.datos.gob.ar/series/api/series/?ids=42.3_EPH_PUNTUATAL_0_M_30",
      "licencia": "CC-BY-4.0",
      "id_api": "42.3_EPH_PUNTUATAL_0_M_30"
    }
  ],
  "licencia": "CC-BY-4.0",
  "cita": "Vaivén (2026). Tasa de desocupación, variante «total-urbano». Versión de datos 2026-10-24. https://vaiven.argentino.workers.dev/series/desocupacion/",
  "version_datos": "2026-10-24T23:04:00Z",
  "desactualizada_desde": null,
  "datos": [
    ["1974-05", 5.0],
    ["1974-11", 3.4],
    ["1975-05", 3.5],
    ["1975-11", 3.8],
    ["1976-05", 5.2],
    ["1976-11", 4.4],
    ["1977-05", 3.9],
    ["1977-11", 2.7],
    ["1978-05", 4.2],
    ["1978-11", 2.3],
    ["1979-05", 2.6],
    ["1979-11", 2.4],
    ["1980-05", 2.6],
    ["1980-11", 2.5],
    ["1981-05", 4.2],
    ["1981-11", 5.3],
    ["1982-05", 6.0],
    ["1982-11", 4.6],
    ["1983-05", 5.5],
    ["1983-11", 3.9],
    ["1984-05", 4.7],
    ["1984-11", 4.4],
    ["1985-05", 6.3],
    ["1985-11", 5.9],
    ["1986-05", 5.9],
    ["1986-11", 5.2],
    ["1987-05", 6.0],
    ["1987-11", 5.7],
    ["1988-05", 6.5],
    ["1988-11", 6.1],
    ["1989-05", 8.1],
    ["1989-11", 7.1],
    ["1990-05", 8.6],
    ["1990-11", 6.3],
    ["1991-05", 6.9],
    ["1991-11", 6.0],
    ["1992-05", 6.9],
    ["1992-11", 7.0],
    ["1993-05", 9.9],
    ["1993-11", 9.3],
    ["1994-05", 10.7],
    ["1994-11", 12.2],
    ["1995-05", 18.4],
    ["1995-11", 16.6],
    ["1996-05", 17.1],
    ["1996-11", 17.3],
    ["1997-05", 16.1],
    ["1997-11", 13.7],
    ["1998-05", 13.2],
    ["1998-11", 12.4],
    ["1999-05", 14.5],
    ["1999-11", 13.8],
    ["2000-05", 15.4],
    ["2000-11", 14.7],
    ["2001-05", 16.4],
    ["2001-11", 18.3],
    ["2002-05", 21.5],
    ["2002-11", 17.8],
    ["2003-05", 15.6],
    ["2003-07", 16.14696649],
    ["2003-10", 14.44716694],
    ["2004-01", 14.2769287],
    ["2004-04", 14.65347815],
    ["2004-07", 13.13133934],
    ["2004-10", 12.02187928],
    ["2005-01", 12.91846312],
    ["2005-04", 11.96451473],
    ["2005-07", 11.1217672],
    ["2005-10", 10.0354948],
    ["2006-01", 11.30833635],
    ["2006-04", 10.32490984],
    ["2006-07", 10.09459815],
    ["2006-10", 8.624367381],
    ["2007-01", 9.689335538],
    ["2007-04", 8.287783693],
    ["2007-07", 8.1],
    ["2007-10", 7.522466867],
    ["2008-01", 8.310571629],
    ["2008-04", 7.9540599],
    ["2008-07", 7.774917568],
    ["2008-10", 7.278622275],
    ["2009-01", 8.361046824],
    ["2009-04", 8.739179026],
    ["2009-07", 9.087527355],
    ["2009-10", 8.37217813],
    ["2010-01", 8.3],
    ["2010-04", 7.9],
    ["2010-07", 7.5],
    ["2010-10", 7.3],
    ["2011-01", 7.4],
    ["2011-04", 7.3],
    ["2011-07", 7.2],
    ["2011-10", 6.7],
    ["2012-01", 7.1],
    ["2012-04", 7.2],
    ["2012-07", 7.6],
    ["2012-10", 6.9],
    ["2013-01", 7.9],
    ["2013-04", 7.2],
    ["2013-07", 6.8],
    ["2013-10", 6.4],
    ["2014-01", 7.1],
    ["2014-04", 7.1],
    ["2014-07", 7.5],
    ["2014-10", 6.9],
    ["2015-01", 7.1],
    ["2015-04", 6.6],
    ["2015-07", 5.9],
    ["2016-04", 9.3],
    ["2016-07", 8.5],
    ["2016-10", 7.6],
    ["2017-01", 9.2],
    ["2017-04", 8.7],
    ["2017-07", 8.3],
    ["2017-10", 7.2],
    ["2018-01", 9.1],
    ["2018-04", 9.6],
    ["2018-07", 9.0],
    ["2018-10", 9.1],
    ["2019-01", 10.1],
    ["2019-04", 10.6],
    ["2019-07", 9.7],
    ["2019-10", 8.9],
    ["2020-01", 10.4],
    ["2020-04", 13.1],
    ["2020-07", 11.7],
    ["2020-10", 10.95793221],
    ["2021-01", 10.2],
    ["2021-04", 9.600903336],
    ["2021-07", 8.2],
    ["2021-10", 7.0],
    ["2022-01", 7.0],
    ["2022-04", 6.9],
    ["2022-07", 7.1],
    ["2022-10", 6.281803916],
    ["2023-01", 6.874527538],
    ["2023-04", 6.2],
    ["2023-07", 5.726029871],
    ["2023-10", 5.7],
    ["2024-01", 7.7],
    ["2024-04", 7.564412576],
    ["2024-07", 6.9],
    ["2024-10", 6.4],
    ["2025-01", 7.9],
    ["2025-04", 7.576238909],
    ["2025-07", 6.6],
    ["2025-10", 7.5],
    ["2026-01", 7.8],
    ["2026-04", 7.9]
  ]
}
