{
  "esquema": "1.2",
  "id": "deuda-externa.privada",
  "serie": "deuda-externa",
  "codigo": "EXT-07",
  "nombre": "Deuda externa total",
  "variante": "privada",
  "nombre_variante": "Banco Mundial, privada no garantizada, de largo plazo (1970–2024)",
  "es_variante_por_defecto": false,
  "unidad": "millones de US$ corrientes",
  "tipo": "stock",
  "agregacion": "fin_de_periodo",
  "frecuencia": "anual",
  "moneda": "dolares",
  "metodo": "Deuda externa de largo plazo del sector privado sin garantía pública, según el Banco Mundial (DT.DOD.DPNG.CD). No incluye la deuda privada de corto plazo, que en el Banco Mundial va en otro rubro sin separar por sector.",
  "empalme": "yuxtaponer",
  "transformaciones": [
    "var_interanual",
    "base_100",
    "frecuencia",
    "media_movil",
    "pct_pib"
  ],
  "insumos": {
    "pct_pib": {
      "opciones": [
        {
          "id": "pib-dolares.anual",
          "archivo": "auxiliares/pib-dolares/anual.json",
          "nombre": "Anual",
          "frecuencia": "anual"
        },
        {
          "id": "pib-dolares.trimestral",
          "archivo": "auxiliares/pib-dolares/trimestral.json",
          "nombre": "Trimestral (desde 1993)",
          "frecuencia": "trimestral"
        }
      ],
      "por_defecto": "pib-dolares.anual",
      "unidad": "% del PIB"
    }
  },
  "auxiliar": false,
  "tramos": [
    {
      "fuente": "f.bm.deuda-externa-privada",
      "desde": "1970",
      "hasta": "hoy",
      "frecuencia": "anual"
    }
  ],
  "cobertura": {
    "desde": "1970",
    "hasta": "2024"
  },
  "advertencias": [
    {
      "id": "q.deuda-externa.criterios",
      "desde": "1970",
      "hasta": null,
      "tipo": "metodologia",
      "descripcion": "El Banco Mundial y el INDEC registran la deuda externa con criterios distintos y sus cifras no coinciden: en 1993–2000 el Banco Mundial da entre 4 % menos y 10 % más que el INDEC, pero en 1991, 1992 y 2001 da entre 44 % y 66 % más, y entre 2006 y 2023 da entre 21 % menos y 6 % más (−13 % en 2006, −12 % en 2023). Las variantes no se unen: para comparar en el tiempo, conviene usar una sola."
    },
    {
      "id": "q.deuda-externa.componentes-bm",
      "desde": "1970",
      "hasta": null,
      "tipo": "metodologia",
      "descripcion": "La pública y la privada del Banco Mundial son solo de largo plazo: no suman el total, que además incluye el crédito del FMI y la deuda de corto plazo (por ejemplo, en 1990: 47.154 + 1.800 de largo plazo, 3.083 del FMI y 10.440 de corto plazo, sobre un total de 62.478 millones)."
    }
  ],
  "excluidos": [],
  "fuentes": [
    {
      "id": "f.bm.deuda-externa-privada",
      "organismo": "Banco Mundial (International Debt Statistics)",
      "nombre": "Deuda externa de largo plazo privada no garantizada (stock), en US$ corrientes (DT.DOD.DPNG.CD), Argentina",
      "url": "https://data.worldbank.org/indicator/DT.DOD.DPNG.CD?locations=AR",
      "licencia": "CC-BY-4.0",
      "id_api": "DT.DOD.DPNG.CD"
    }
  ],
  "licencia": "CC-BY-4.0",
  "cita": "Vaivén (2026). Deuda externa total, variante «privada». Versión de datos 2026-10-27. https://vaiven.argentino.workers.dev/series/deuda-externa/privada/",
  "version_datos": "2026-10-27T19:55:59Z",
  "desactualizada_desde": null,
  "datos": [
    ["1970", 3291.0],
    ["1971", 3410.0],
    ["1972", 3461.0],
    ["1973", 3432.0],
    ["1974", 3460.0],
    ["1975", 3457.0],
    ["1976", 3298.0],
    ["1977", 3267.0],
    ["1978", 3102.0],
    ["1979", 5438.8],
    ["1980", 6593.0],
    ["1981", 12166.0],
    ["1982", 11227.0],
    ["1983", 10393.0],
    ["1984", 10340.0],
    ["1985", 4575.0],
    ["1986", 4341.0],
    ["1987", 1853.0],
    ["1988", 1800.0],
    ["1989", 1800.0],
    ["1990", 1800.0],
    ["1991", 1800.0],
    ["1992", 2244.0],
    ["1993", 6369.425],
    ["1994", 13123.172],
    ["1995", 16066.427],
    ["1996", 19068.321],
    ["1997", 23410.631],
    ["1998", 27865.489],
    ["1999", 27319.463],
    ["2000", 25909.346],
    ["2001", 31628.07],
    ["2002", 28479.0],
    ["2003", 28386.742],
    ["2004", 23810.501],
    ["2005", 26360.824],
    ["2006", 26810.522],
    ["2007", 30028.062],
    ["2008", 38898.788],
    ["2009", 35445.519],
    ["2010", 37934.27617],
    ["2011", 42499.35063],
    ["2012", 40943.426],
    ["2013", 40536.224],
    ["2014", 40703.142],
    ["2015", 42130.407],
    ["2016", 31303.35],
    ["2017", 39295.205],
    ["2018", 43531.058],
    ["2019", 45424.853],
    ["2020", 46042.357],
    ["2021", 39527.173],
    ["2022", 37017.961],
    ["2023", 37180.319],
    ["2024", 35988.669]
  ]
}
